{
  "id": "2026",
  "name": "Garage Games 2026 Draft",
  "timerSeconds": 300,
  "requiredCompletions": 13,
  "scoringPolicy": "2026-time-decay",
  "bonusPointsPerGame": 10,
  "attemptBonusThreshold": 13,
  "attemptBonusPoints": 25,
  "timeBonusCompletionThreshold": 13,
  "draft": true,
  "scoringSettings": {
    "basePoints": 100,
    "minimumPoints": 50,
    "decayIntervalSeconds": 5,
    "decayPointsPerInterval": 5
  },
  "games": [
    { "id": "slot-01", "name": "2026 Game 1", "shortName": "game-01", "order": 1, "weight": 100 },
    { "id": "slot-02", "name": "2026 Game 2", "shortName": "game-02", "order": 2, "weight": 100 },
    { "id": "slot-03", "name": "2026 Game 3", "shortName": "game-03", "order": 3, "weight": 100 },
    { "id": "slot-04", "name": "2026 Game 4", "shortName": "game-04", "order": 4, "weight": 100 },
    { "id": "slot-05", "name": "2026 Game 5", "shortName": "game-05", "order": 5, "weight": 100 },
    { "id": "slot-06", "name": "2026 Game 6", "shortName": "game-06", "order": 6, "weight": 100 },
    { "id": "slot-07", "name": "2026 Game 7", "shortName": "game-07", "order": 7, "weight": 100 },
    { "id": "slot-08", "name": "2026 Game 8", "shortName": "game-08", "order": 8, "weight": 100 },
    { "id": "slot-09", "name": "2026 Game 9", "shortName": "game-09", "order": 9, "weight": 100 },
    { "id": "slot-10", "name": "2026 Game 10", "shortName": "game-10", "order": 10, "weight": 100 },
    { "id": "slot-11", "name": "2026 Game 11", "shortName": "game-11", "order": 11, "weight": 100 },
    { "id": "slot-12", "name": "2026 Game 12", "shortName": "game-12", "order": 12, "weight": 100 },
    { "id": "slot-13", "name": "2026 Game 13", "shortName": "game-13", "order": 13, "weight": 100 }
  ]
}

